<!ELEMENT empresa (nombre,direccion,servicios,productos)>
<!ELEMENT nombre (#PCDATA)>
<!ATTLIST nombre categoria NMTOKEN #IMPLIED>
<!ELEMENT direccion (calle,ciudad,pais)>
<!ELEMENT calle (#PCDATA)>
<!ELEMENT ciudad (#PCDATA)>
<!ELEMENT pais (#PCDATA)>
<!ELEMENT servicios (servicio+)>
<!ELEMENT servicio (nombre,descripcion,imagen)>
<!ELEMENT descripcion (#PCDATA)>
<!ELEMENT imagen (#PCDATA)>
<!ELEMENT productos (producto+)>
<!ELEMENT producto (nombre,descripcion,precio,imagen)>
<!ELEMENT precio (#PCDATA)>